question,valid_question,valid_answer,question_type,group,is_original
"UK AI strategy, who official in charge?",True,True,relevant (variants),48,False
Which part of the government is responsible for AI policies in Serbia?,True,True,relevant (original),49,True
What government sector in Serbia handles AI policies?,True,True,relevant (variants),49,False
Who in the Serbian government is in charge of AI policies?,True,True,relevant (variants),49,False
AI policies in Serbia are managed by which government department?,True,True,relevant (variants),49,False
"Serbia government, which part take care AI policies?",True,True,relevant (variants),49,False
Which parts of the Finnish government are involved in AI policymaking?,True,True,relevant (original),50,True
What sections of the Finnish government participate in AI policy formulation?,True,True,relevant (variants),50,False
Can you tell me the Finnish government departments that are part of AI policy creation?,True,True,relevant (variants),50,False
Which Finnish government areas are in AI policy making?,True,True,relevant (variants),50,False
"Finnish government, which parts make AI policy?",True,True,relevant (variants),50,False
Which countries have established ethics or oversight bodies for AI?,True,True,relevant (original),51,True
Can you tell me the countries that have set up ethics or oversight bodies for AI?,True,True,relevant (variants),51,False
What are the countries with established AI ethics or oversight bodies?,True,True,relevant (variants),51,False
Which nations have ethics or oversight bodies for AI in place?,True,True,relevant (variants),51,False
"Countries with ethics or oversight bodies for AI, which ones?",True,True,relevant (variants),51,False
What is the timeline of Slovenia’s implementation of its national AI strategy?,True,True,relevant (original),52,True
Can you tell me the timeline for the implementation of Slovenia's national AI strategy?,True,True,relevant (variants),52,False
When did Slovenia implement its national AI strategy?,True,True,relevant (variants),52,False
What's the schedule of Slovenia's national AI strategy implementation?,True,True,relevant (variants),52,False
"Slovenia national AI strategy, when implement?",True,True,relevant (variants),52,False
What is the timeline of Korea’s implementation of its national AI strategy?,True,True,relevant (original),53,True
Can you tell me the timeline for the implementation of Korea's national AI strategy?,True,True,relevant (variants),53,False
When did Korea start implementing its national AI strategy and what's the timeline?,True,True,relevant (variants),53,False
What's the schedule for Korea's national AI strategy implementation?,True,True,relevant (variants),53,False
"Korea national AI strategy, when they start?",True,True,relevant (variants),53,False
In which year has the second phase of France’s national AI strategy started?,True,True,relevant (original),54,True
When did the second phase of France's national AI strategy begin?,True,True,relevant (variants),54,False
What year marked the start of the second phase of France's national AI strategy?,True,True,relevant (variants),54,False
In what year did France's national AI strategy enter its second phase?,True,True,relevant (variants),54,False
Year of start for second phase of France AI strategy?,True,True,relevant (variants),54,False
How is Canada evaluating the success of its AI strategy?,True,True,relevant (original),55,True
What methods is Canada using to assess the effectiveness of its AI strategy?,True,True,relevant (variants),55,False
How does Canada determine if its AI strategy is successful?,True,True,relevant (variants),55,False
In what ways is Canada measuring the success of its AI strategy?,True,True,relevant (variants),55,False
"Canada AI strategy success, how check?",True,True,relevant (variants),55,False
What are the indicators listed in the Egypt AI strategy to monitor progress of actions?,True,True,relevant (original),56,True
What are the measures mentioned in Egypt's AI strategy to track the progress of actions?,True,True,relevant (variants),56,False
"In the AI strategy of Egypt, what are the indicators used to monitor action progress?",True,True,relevant (variants),56,False
What indicators does the Egypt AI strategy use to keep track of action progress?,True,True,relevant (variants),56,False
"Egypt AI strategy, what indicators listed for monitor progress of actions?",True,True,relevant (variants),56,False
How much is the United Kingdom’s AI strategy investing in AI?,True,True,relevant (original),57,True
What is the amount of investment in AI by the United Kingdom's AI strategy?,True,True,relevant (variants),57,False
What's the UK's AI strategy's investment in AI?,True,True,relevant (variants),57,False
How much money is the UK AI strategy putting into AI?,True,True,relevant (variants),57,False
"UK AI strategy, how much they investing in AI?",True,True,relevant (variants),57,False
What is the budget of the French national AI strategy?,True,True,relevant (original),58,True
What's the amount allocated for the French national AI strategy?,True,True,relevant (variants),58,False
Can you tell me the budget for the French national AI strategy?,True,True,relevant (variants),58,False
Do you know the budget of the French national AI strategy?,True,True,relevant (variants),58,False
French national AI strategy budget is how much?,True,True,relevant (variants),58,False
Has the EU proposed specific legislation on AI?,True,True,relevant (original),59,True
Did the EU put forward any particular laws on AI?,True,True,relevant (variants),59,False
Has there been any AI-specific legislation proposed by the EU?,True,True,relevant (variants),59,False
Did the EU suggest any specific AI laws?,True,True,relevant (variants),59,False
EU propose specific AI law?,True,True,relevant (variants),59,False
Has Canada proposed specific legislation on AI?,True,True,relevant (original),60,True
Did Canada suggest any particular laws regarding AI?,True,True,relevant (variants),60,False
Has there been any AI-specific legislation proposed by Canada?,True,True,relevant (variants),60,False
Is there any specific AI legislation that Canada has proposed?,True,True,relevant (variants),60,False
Canada propose specific AI law?,True,True,relevant (variants),60,False
Which legislation in Japan applies to AI?,True,True,relevant (original),61,True
What is the applicable legislation for AI in Japan?,True,True,relevant (variants),61,False
Can you tell me the legislation that applies to AI in Japan?,True,True,relevant (variants),61,False
Do you know the Japanese legislation for AI?,True,True,relevant (variants),61,False
"Japan AI, which legislation apply?",True,True,relevant (variants),61,False
What are the most effective ways to promote a healthy work-life balance in modern society?,False,False,irrelevant,62,True
How can urban planning and design contribute to the creation of more sustainable and livable cities?,False,False,irrelevant,63,True
"What role do bees play in the ecosystem, and what can be done to protect their populations from decline?",False,False,irrelevant,64,True
"What are the most promising emerging technologies for addressing the global water crisis, and how can they be scaled up?",False,False,irrelevant,65,True
How has the introduction of cryptocurrencies and blockchain technology influenced the global financial landscape?,False,False,irrelevant,66,True
"What are the key factors contributing to the rise in global obesity rates, and how can policymakers address this public health issue?",False,False,irrelevant,67,True
How can we promote sustainable tourism practices that benefit both local communities and the environment?,False,False,irrelevant,68,True
"What are some effective strategies for reducing food waste at the individual, household, and institutional levels?",False,False,irrelevant,69,True
"How has the evolution of social media impacted political discourse and the spread of information, both accurate and inaccurate?",False,False,irrelevant,70,True
What are some of the most significant challenges and opportunities associated with space exploration in the 21st century?,False,False,irrelevant,71,True
How can we encourage the use of renewable energy sources and reduce dependence on fossil fuels?,False,False,irrelevant,72,True
What are the key factors that contribute to the development and preservation of cultural heritage in a rapidly globalizing world?,False,False,irrelevant,73,True
"How can we promote greater gender equality and empower women in various aspects of society, including education, employment, and political representation?",False,False,irrelevant,74,True
What are some innovative methods for addressing the growing issue of plastic pollution in oceans and waterways?,False,False,irrelevant,75,True
How can the global community work together to prevent the spread of infectious diseases and prepare for potential pandemics?,False,False,irrelevant,76,True
"What are the key factors that influence the taste and quality of different types of wine, and how can this knowledge be used to make better wine selections?",False,False,irrelevant,77,True
How have advances in virtual reality and augmented reality technologies impacted the gaming industry and the way we interact with digital content?,False,False,irrelevant,78,True
"What role do pets play in human well-being and mental health, and what are the benefits and challenges of pet ownership?",False,False,irrelevant,79,True
"What are the primary causes of traffic congestion in urban areas, and what solutions can be implemented to alleviate this problem?",False,False,irrelevant,80,True
"How can the arts, such as music, theater, and visual arts, contribute to the overall well-being and personal development of individuals and communities?",False,False,irrelevant,81,True
"What are the most effective methods for learning a new language and achieving fluency, and how do these methods vary among different age groups?",False,False,irrelevant,82,True
What are some strategies for maintaining personal motivation and productivity while working remotely or in a flexible work environment?,False,False,irrelevant,83,True
"How has the increasing popularity of plant-based diets influenced the food industry, and what are the potential health and environmental benefits of adopting such a diet?",False,False,irrelevant,84,True
"What are the primary factors that contribute to the formation of natural disasters, such as earthquakes, hurricanes, and volcanic eruptions, and how can communities better prepare for these events?",False,False,irrelevant,85,True
How can urban agriculture and community gardens contribute to local food security and overall community well-being?,False,False,irrelevant,86,True
What are some innovative approaches to waste management and recycling that can help reduce the environmental impact of human activities?,False,False,irrelevant,87,True
How can we foster greater understanding and empathy between individuals of diverse cultural backgrounds to promote social cohesion and reduce prejudice?,False,False,irrelevant,88,True
What are the most effective ways to teach children about the importance of financial literacy and responsible money management?,False,False,irrelevant,89,True
"How has the growth of e-commerce and online shopping impacted traditional brick-and-mortar retail businesses, and what strategies can they employ to stay competitive?",False,False,irrelevant,90,True
"What are some of the most interesting and unusual hobbies or pastimes that people engage in around the world, and what can we learn from them?",False,False,irrelevant,91,True
How does the United States' AI in Government Act ensure the responsible and ethical use of AI technologies in public services?,True,False,trick,92,True
"In Germany's AI Liability Act, how is liability determined when multiple AI systems or a combination of AI and human decisions lead to harm or incorrect decisions?",True,False,trick,93,True
How does France's AI Transparency and Accountability Act ensure that AI developers comply with the requirement to provide explanations for their algorithms' decision-making processes?,True,False,trick,94,True
How does Canada's Algorithmic Impact Assessment Framework balance the benefits of AI systems in the public sector with the potential risks to individuals' rights and freedoms?,True,False,trick,95,True
To what extent do Japan's Guidelines for AI and Data Utilization provide clear and actionable recommendations for AI developers and users?,True,False,trick,96,True
What measures are included in China's New Generation Artificial Intelligence Development Plan to encourage international collaboration and knowledge-sharing in the field of AI?,True,False,trick,97,True
In what ways does France's High Council for AI (CPAI) contribute to the global discourse on AI governance and ethics?,True,False,trick,98,True
How does Nigeria's National AI Strategy for Nigeria (NAISN) plan to attract foreign investment and expertise to boost the country's AI capabilities?,True,False,trick,99,True
What measures does the AI Empowerment and Inclusion Act in Nigeria propose to ensure that underserved communities have equal access to AI resources and opportunities?,True,False,trick,100,True
How does South Africa's AI for Social Good Initiative incentivize the development of AI solutions to address the country's most pressing socio-economic challenges?,True,False,trick,101,True
"To what extent does the Data Privacy and AI Regulation Act in South Africa align with international data protection standards, such as the EU's General Data Protection Regulation (GDPR)?",True,False,trick,102,True
How does Kenya's AI Vision 2030 plan to promote collaboration between the public and private sectors to drive AI innovation and adoption?,True,False,trick,103,True
What specific provisions are included in Kenya's AI for Sustainable Development Act to encourage the use of AI in environmental conservation and renewable energy sectors?,True,False,trick,104,True
In what ways does the AI for Smart Cities Act in Egypt support the development and implementation of AI technologies in urban planning to improve public services and infrastructure?,True,False,trick,105,True
How does Ghana's AI Development Initiative (GAIDI) plan to leverage partnerships with regional and international AI organizations to strengthen the country's AI ecosystem?,True,False,trick,106,True
What strategies are proposed in Ghana's AI for Healthcare Act to ensure the successful development and deployment of AI applications in healthcare services across the country?,True,False,trick,107,True
How does Rwanda's AI Roadmap 2030 envision fostering a skilled workforce capable of driving AI innovation and adoption within the country?,True,False,trick,108,True
How does Sweden's AI for Education and Skills Development Act plan to integrate AI technologies into educational curricula and promote training opportunities in STEM fields?,True,False,trick,109,True
What specific measures does Brazil's AI for Economic Growth and Social Inclusion Act propose to ensure that AI technologies benefit all segments of society?,True,False,trick,110,True
How does Argentina's AI for Sustainable Agriculture Initiative support the adoption of AI technologies to enhance agricultural productivity and promote sustainable farming practices?,True,False,trick,111,True
"To what extent does the Data Privacy and AI Regulation Act in Argentina align with international data protection standards, such as the EU's General Data Protection Regulation (GDPR)?",True,False,trick,112,True
"How does Chile's AI Vision 2030 plan to promote collaboration between various stakeholders, including the government, industry, and academia, to drive AI innovation and adoption?",True,False,trick,113,True
What specific provisions are included in Chile's AI for Renewable Energy and Environmental Conservation Act to encourage the use of AI in clean energy and environmental protection efforts?,True,False,trick,114,True
"In what ways does the AI for Public Health and Safety Act in Colombia support the development and implementation of AI technologies in healthcare, disaster response, and crime prevention?",True,False,trick,115,True
How does Peru's AI Development Initiative (PADI) plan to leverage partnerships with regional and international AI organizations to strengthen the country's AI ecosystem?,True,False,trick,116,True
What strategies are proposed in Peru's AI for Cultural Heritage Preservation Act to ensure the successful integration of AI applications in cultural preservation and documentation efforts?,True,False,trick,117,True
How does Uruguay's AI Roadmap 2030 envision fostering a skilled workforce capable of driving AI innovation and adoption within the country?,True,False,trick,118,True
How does India's AI for Education and Workforce Development Act plan to integrate AI technologies into educational curricula and promote training opportunities in technology and innovation fields?,True,False,trick,119,True
"What are the main points of the Artificial Intelligence Regulation Act of 2023, ratified by the United Nations?",True,False,trick,120,True
"Can you detail the steps involved in the ""Neural Networks Transparency Protocol"" enacted by the European Union in 2022?",True,False,trick,121,True
What are the primary clauses of the 2021 United Nations AI Morality Act?,True,False,trick,122,True
How did the 'AI First' policy adopted by New Zealand in 2020 impact their economy?,True,False,trick,123,True
How has Canada's AI and Robotics Taxation Act of 2022 affected employment?,True,False,trick,124,True
How did the OECD react to Brazil's decision to withdraw from the 2024 AI Climate Accord?,True,False,trick,125,True
What are the implications of Russia's proposed restrictions on AI in defense sectors in 2025?,True,False,trick,126,True
How are Australian companies adapting to the 2023 Melbourne AI fairness rules?,True,False,trick,127,True
What are the key elements of Japan's AI and Robotics for Elderly Care Act?,True,False,trick,128,True
What is the impact of South Africa's 2025 AI for Wildlife Conservation policy?,True,False,trick,129,True
How have the Middle East's AI for Renewable Energy regulations affected the global energy market since their implementation in 2019?,True,False,trick,130,True
"What are the key takeaways from the Beijing Accord on AI Transparency, adopted in 2026?",True,False,trick,131,True
How has the AI in Agriculture Act of 2021 changed farming practices in Mexico?,True,False,trick,132,True
What is the least relevant key pillar of AI policy in Canada?,True,False,trick,133,True
