question,valid_question,valid_answer,question_type,group,is_original
Which European countries have AI policies?,True,True,relevant (original),0,True
Which countries in Europe have implemented AI policies?,True,True,relevant (variants),0,False
Can you list the European countries that have AI policies?,True,True,relevant (variants),0,False
Do you know the European countries with AI policies?,True,True,relevant (variants),0,False
Europe countries with AI policies which ones?,True,True,relevant (variants),0,False
Which Latin American countries have AI policies?,True,True,relevant (original),1,True
Which countries in Latin America have policies on Artificial Intelligence?,True,True,relevant (variants),1,False
Can you list the Latin American countries that have implemented AI policies?,True,True,relevant (variants),1,False
Do you know any Latin American countries with AI policies?,True,True,relevant (variants),1,False
"Latin American countries, AI policies, which ones have?",True,True,relevant (variants),1,False
How many countries have a national AI strategy?,True,True,relevant (original),2,True
What's the count of countries that possess a national AI strategy?,True,True,relevant (variants),2,False
How many nations have implemented a national strategy for AI?,True,True,relevant (variants),2,False
Number of countries with a national AI strategy?,True,True,relevant (variants),2,False
"Countries have national AI strategy, how many?",True,True,relevant (variants),2,False
What are the most common AI policies?,True,True,relevant (original),3,True
Can you tell me the most prevalent AI policies?,True,True,relevant (variants),3,False
What AI policies are most frequently used?,True,True,relevant (variants),3,False
"Most common policies in AI, what are they?",True,True,relevant (variants),3,False
"AI policies, which ones common most?",True,True,relevant (variants),3,False
What are some examples of success factors for AI strategies?,True,True,relevant (original),4,True
Can you provide some examples of success factors for AI strategies?,True,True,relevant (variants),4,False
What could be some successful elements for AI strategies?,True,True,relevant (variants),4,False
What are the key factors for a successful AI strategy?,True,True,relevant (variants),4,False
What success factors for AI strategies you know?,True,True,relevant (variants),4,False
How are countries monitoring and evaluating AI policy implementation?,True,True,relevant (original),5,True
What methods are countries using to monitor and evaluate the implementation of AI policies?,True,True,relevant (variants),5,False
How is the implementation of AI policy being monitored and evaluated by countries?,True,True,relevant (variants),5,False
"Countries, how they monitor and evaluate AI policy implementation?",True,True,relevant (variants),5,False
"AI policy implementation, how countries are checking and assessing?",True,True,relevant (variants),5,False
What are the most common AI policies related to transparency?,True,True,relevant (original),6,True
Can you tell me the most prevalent AI policies regarding transparency?,True,True,relevant (variants),6,False
What are the typical transparency-related AI policies?,True,True,relevant (variants),6,False
What AI policies are most common for transparency?,True,True,relevant (variants),6,False
"AI policies for transparency, which ones common?",True,True,relevant (variants),6,False
Which countries have a register of AI systems used in the public sector?,True,True,relevant (original),7,True
Can you tell me the countries that maintain a register of AI systems used in the public sector?,True,True,relevant (variants),7,False
Do you know the countries with a register of public sector AI systems?,True,True,relevant (variants),7,False
Which nations keep a record of AI systems in the public sector?,True,True,relevant (variants),7,False
Countries have register of AI systems in public sector?,True,True,relevant (variants),7,False
Which countries have AI policies (regulations) on the use of AI in the workplace?,True,True,relevant (original),8,True
Can you list the countries that have AI regulations for workplace use?,True,True,relevant (variants),8,False
Do you know which nations have implemented AI policies for use in the work environment?,True,True,relevant (variants),8,False
Which countries have rules about using AI at work?,True,True,relevant (variants),8,False
Countries have AI use in work place rules?,True,True,relevant (variants),8,False
Which countries have conducted an evaluation of their national AI strategy?,True,True,relevant (original),9,True
Which nations have assessed their national AI strategy?,True,True,relevant (variants),9,False
Can you tell me the countries that have evaluated their national AI strategy?,True,True,relevant (variants),9,False
Do you know the countries that have done an evaluation of their national AI strategy?,True,True,relevant (variants),9,False
Countries that have checked their national AI strategy?,True,True,relevant (variants),9,False
Which countries have set up AI research centres?,True,True,relevant (original),10,True
Can you list the countries that have established AI research centres?,True,True,relevant (variants),10,False
Do you know the countries where AI research centres are located?,True,True,relevant (variants),10,False
Which nations have AI research centres?,True,True,relevant (variants),10,False
"Countries with AI research centres, which are they?",True,True,relevant (variants),10,False
What are the main policies to foster AI skills in EU countries?,True,True,relevant (original),11,True
What are the primary strategies to promote AI abilities in European Union nations?,True,True,relevant (variants),11,False
What's the main approach to encourage AI expertise in countries of the EU?,True,True,relevant (variants),11,False
What policies are in place to boost AI skills in EU countries?,True,True,relevant (variants),11,False
What be main rules for push AI skill in EU country?,True,True,relevant (variants),11,False
Which countries are developing AI policies aimed at either reducing emissions or fostering the green transition?,True,True,relevant (original),12,True
Which nations are formulating AI strategies to lower emissions or promote green transition?,True,True,relevant (variants),12,False
Can you list the countries that are creating AI policies for emission reduction or green transition?,True,True,relevant (variants),12,False
Which countries are making AI policies for either emission reduction or green transition?,True,True,relevant (variants),12,False
Countries which are making AI policies for reducing emissions or green transition?,True,True,relevant (variants),12,False
Which countries have established a dedicated (either digital or AI) ministry to advance their policies?,True,True,relevant (original),13,True
Can you tell me the countries that have set up a specific ministry for digital or AI to progress their policies?,True,True,relevant (variants),13,False
Do you know the nations that have a dedicated ministry for digital or AI to enhance their policies?,True,True,relevant (variants),13,False
Which nations got a special ministry for digital or AI for better policies?,True,True,relevant (variants),13,False
Countries with special ministry for digital or AI for policy better?,True,True,relevant (variants),13,False
Which countries are collaborating to foster cross-border AI policy initiatives?,True,True,relevant (original),14,True
Which nations are working together to promote AI policy initiatives across borders?,True,True,relevant (variants),14,False
Can you tell me the countries that are partnering to advance cross-border AI policy initiatives?,True,True,relevant (variants),14,False
Which countries are jointly pushing for cross-border AI policy initiatives?,True,True,relevant (variants),14,False
Countries which are doing teamwork for cross-border AI policy initiatives?,True,True,relevant (variants),14,False
What is the focus of Italy’s AI policy strategy?,True,True,relevant (original),15,True
What does Italy's AI policy strategy primarily concentrate on?,True,True,relevant (variants),15,False
Can you tell me the main focus of Italy's AI policy strategy?,True,True,relevant (variants),15,False
What's the main point of Italy's strategy for AI policy?,True,True,relevant (variants),15,False
Italy AI policy strategy focus what is?,True,True,relevant (variants),15,False
What are the main priorities of the Australian AI Action Plan?,True,True,relevant (original),16,True
Can you list the primary objectives of the Australian AI Action Plan?,True,True,relevant (variants),16,False
What are the key focuses of the Australian AI Action Plan?,True,True,relevant (variants),16,False
What's the main agenda of the Australian AI Action Plan?,True,True,relevant (variants),16,False
"Australian AI Action Plan, what main things it focus?",True,True,relevant (variants),16,False
Which sectors does France’s AI policies focus on?,True,True,relevant (original),17,True
What are the sectors targeted by France's AI policies?,True,True,relevant (variants),17,False
Can you tell me the sectors that France's AI policies are focusing on?,True,True,relevant (variants),17,False
"France's AI policies, which sectors do they focus on?",True,True,relevant (variants),17,False
"Sectors, France AI policies focus on which?",True,True,relevant (variants),17,False
What are three AI policy examples in the USA?,True,True,relevant (original),18,True
Can you name three examples of AI policy in the USA?,True,True,relevant (variants),18,False
What are three instances of AI policy in the United States?,True,True,relevant (variants),18,False
Could you provide three examples of AI policy in America?,True,True,relevant (variants),18,False
"Three AI policy examples in USA, what are?",True,True,relevant (variants),18,False
What areas of the AI ecosystem does Germany's AI strategy tend to focus on?,True,True,relevant (original),19,True
Which sectors of the AI ecosystem are the main focus of Germany's AI strategy?,True,True,relevant (variants),19,False
What are the key areas of the AI ecosystem that Germany's AI strategy emphasizes?,True,True,relevant (variants),19,False
"Germany's AI strategy, what areas of the AI ecosystem it focus?",True,True,relevant (variants),19,False
"AI ecosystem, where Germany AI strategy focus?",True,True,relevant (variants),19,False
What are the most important AI policies in Canada ?,True,True,relevant (original),20,True
Can you tell me about the key AI policies in Canada?,True,True,relevant (variants),20,False
What's the most significant AI regulations in Canada?,True,True,relevant (variants),20,False
"In Canada, what are the crucial AI policies?",True,True,relevant (variants),20,False
Canada AI important policies what are?,True,True,relevant (variants),20,False
To which extent is Australia's AI Ethics Framework aligned to the OECD AI Principles?,True,True,relevant (original),21,True
How much does Australia's AI Ethics Framework match the OECD AI Principles?,True,True,relevant (variants),21,False
How aligned is the AI Ethics Framework of Australia with the OECD AI Principles?,True,True,relevant (variants),21,False
Is Australia's AI Ethics Framework in line with the OECD AI Principles to a large extent?,True,True,relevant (variants),21,False
"Australia's AI Ethics Framework, it align with OECD AI Principles how much?",True,True,relevant (variants),21,False
How were stakeholders consulted in the elaboration of the AI national strategy of Colombia?,True,True,relevant (original),22,True
What methods were used to consult stakeholders in the development of Colombia's national AI strategy?,True,True,relevant (variants),22,False
In what way did stakeholders participate in the creation of the AI national strategy of Colombia?,True,True,relevant (variants),22,False
How did they ask stakeholders for their input when they were making the AI national strategy of Colombia?,True,True,relevant (variants),22,False
"Stakeholders, how they talk to for Colombia AI national strategy?",True,True,relevant (variants),22,False
What are the key pillars of France’s national AI strategy?,True,True,relevant (original),23,True
Can you tell me the main components of France's national AI strategy?,True,True,relevant (variants),23,False
What are the fundamental elements of the AI strategy in France?,True,True,relevant (variants),23,False
What's the basis of France's AI strategy?,True,True,relevant (variants),23,False
"France AI strategy, what are main parts?",True,True,relevant (variants),23,False
Are there AI policies in Portugal related to transparency?,True,True,relevant (original),24,True
Does Portugal have transparency-related AI policies?,True,True,relevant (variants),24,False
Are there any policies about AI transparency in Portugal?,True,True,relevant (variants),24,False
"In Portugal, is there any transparency policy for AI?",True,True,relevant (variants),24,False
Portugal got AI transparency policy?,True,True,relevant (variants),24,False
Are there AI policies in the EU related to explainability?,True,True,relevant (original),25,True
Does the EU have any AI policies related to explainability?,True,True,relevant (variants),25,False
Are there any explainability-related AI policies in the EU?,True,True,relevant (variants),25,False
"In the EU, are there AI policies that deal with explainability?",True,True,relevant (variants),25,False
EU got AI policies for explainability?,True,True,relevant (variants),25,False
Are there AI policies in France related to robustness?,True,True,relevant (original),26,True
Does France have policies related to AI robustness?,True,True,relevant (variants),26,False
Are there any robustness-related AI policies in France?,True,True,relevant (variants),26,False
"In France, do they have policies about AI robustness?",True,True,relevant (variants),26,False
France got AI robustness policies?,True,True,relevant (variants),26,False
Are there AI policies in Israel related to security?,True,True,relevant (original),27,True
Does Israel have security-related AI policies?,True,True,relevant (variants),27,False
Are there any security policies for AI in Israel?,True,True,relevant (variants),27,False
"In Israel, do they have any AI policies concerning security?",True,True,relevant (variants),27,False
"AI security policies, they have in Israel?",True,True,relevant (variants),27,False
Are there AI policies in Denmark related to safety?,True,True,relevant (original),28,True
Does Denmark have safety-related AI policies?,True,True,relevant (variants),28,False
Are safety policies for AI present in Denmark?,True,True,relevant (variants),28,False
"In Denmark, do they have policies for AI safety?",True,True,relevant (variants),28,False
Denmark got AI safety policies?,True,True,relevant (variants),28,False
Are there AI policies in the UK related to fairness?,True,True,relevant (original),29,True
Does the UK have policies related to fairness in AI?,True,True,relevant (variants),29,False
Are there any fairness-related AI policies in the UK?,True,True,relevant (variants),29,False
"In the UK, do AI policies exist that deal with fairness?",True,True,relevant (variants),29,False
UK got fairness AI policies?,True,True,relevant (variants),29,False
Are there AI policies in the UK related to privacy and data governance?,True,True,relevant (original),30,True
Does the UK have policies on AI regarding privacy and data governance?,True,True,relevant (variants),30,False
Are there any privacy and data governance policies for AI in the UK?,True,True,relevant (variants),30,False
"In the UK, do they have any AI policies that deal with privacy and data governance?",True,True,relevant (variants),30,False
UK got AI policies for privacy and data governance?,True,True,relevant (variants),30,False
Are there AI policies in Japan related to accountability?,True,True,relevant (original),31,True
Does Japan have any AI policies concerning accountability?,True,True,relevant (variants),31,False
Are there any accountability-related AI policies in Japan?,True,True,relevant (variants),31,False
"In Japan, do AI policies exist that deal with accountability?",True,True,relevant (variants),31,False
Japan got AI policies for accountability?,True,True,relevant (variants),31,False
Are there AI policies in Singapore promoting human-centred values?,True,True,relevant (original),32,True
Does Singapore have policies for AI that promote human-centred values?,True,True,relevant (variants),32,False
Are human-centred values promoted by AI policies in Singapore?,True,True,relevant (variants),32,False
"In Singapore, are there AI policies that advocate for human-centred values?",True,True,relevant (variants),32,False
Singapore got AI policies promote human values or not?,True,True,relevant (variants),32,False
Are there AI policies in the US related to transparency?,True,True,relevant (original),33,True
Does the US have transparency-related AI policies?,True,True,relevant (variants),33,False
Are there any policies about AI transparency in the US?,True,True,relevant (variants),33,False
"In the US, do AI policies exist that deal with transparency?",True,True,relevant (variants),33,False
US got AI transparency policies?,True,True,relevant (variants),33,False
Are there any AI policies in Germany focusing on healthcare?,True,True,relevant (original),34,True
Does Germany have any AI policies that focus on healthcare?,True,True,relevant (variants),34,False
Are there AI healthcare policies in place in Germany?,True,True,relevant (variants),34,False
"In Germany, are there any healthcare-focused AI policies?",True,True,relevant (variants),34,False
Germany got any AI policies for healthcare?,True,True,relevant (variants),34,False
Are there any AI policies in Germany focusing on mobility?,True,True,relevant (original),35,True
Does Germany have any AI policies that focus on mobility?,True,True,relevant (variants),35,False
Are there AI mobility policies in place in Germany?,True,True,relevant (variants),35,False
"In Germany, are there any policies on AI related to mobility?",True,True,relevant (variants),35,False
Germany got any AI policies for mobility?,True,True,relevant (variants),35,False
Are there any AI policies related to AI adoption in the public sector in the UK?,True,True,relevant (original),36,True
Does the UK have any AI policies for public sector AI adoption?,True,True,relevant (variants),36,False
Are there AI adoption policies for the public sector in the UK?,True,True,relevant (variants),36,False
"In the UK, are there any policies regarding the adoption of AI in the public sector?",True,True,relevant (variants),36,False
UK public sector got any AI adoption policies?,True,True,relevant (variants),36,False
Are there any AI policies related to AI adoption in the public sector in France?,True,True,relevant (original),37,True
Does France have any AI policies for public sector AI adoption?,True,True,relevant (variants),37,False
Are there AI adoption policies in France's public sector?,True,True,relevant (variants),37,False
"In France, is there any policy related to the adoption of AI in the public sector?",True,True,relevant (variants),37,False
France public sector got AI adoption policy?,True,True,relevant (variants),37,False
Are there any policies targeted to attracting and retaining private investments in AI in Canada?,True,True,relevant (original),38,True
Does Canada have any policies aimed at attracting and retaining private AI investments?,True,True,relevant (variants),38,False
Are there specific policies in Canada for attracting and keeping private AI investments?,True,True,relevant (variants),38,False
"In Canada, are there any policies that focus on attracting and keeping private investments in AI?",True,True,relevant (variants),38,False
Canada got policies for attracting and keeping private AI investments?,True,True,relevant (variants),38,False
Are there any policies targeted to attracting and retaining private investments in AI in Germany?,True,True,relevant (original),39,True
Does Germany have any policies aimed at attracting and retaining private investments in AI?,True,True,relevant (variants),39,False
Are there specific policies in Germany for attracting and keeping private AI investments?,True,True,relevant (variants),39,False
Germany got any rules for keeping private money in AI?,True,True,relevant (variants),39,False
Any policies in Germany for private AI investment attraction and retention?,True,True,relevant (variants),39,False
"Are there any policies targeted to increasing diversity in AI in the Netherlands (e.g. by supporting the inclusion of women, minorities, vulnerable groups, etc. in AI development and use)?",True,True,relevant (original),40,True
"Does the Netherlands have any policies aimed at promoting diversity in AI, such as including women, minorities, and vulnerable groups in AI development and use?",True,True,relevant (variants),40,False
"Are there any Dutch policies that support the inclusion of women, minorities, and vulnerable groups in AI to increase diversity?",True,True,relevant (variants),40,False
"In the Netherlands, are there any policies that aim to increase diversity in AI, for example by supporting the participation of women, minorities, and vulnerable groups in AI development and use?",True,True,relevant (variants),40,False
"Any policies in Netherlands for increasing diversity in AI, like supporting women, minorities, vulnerable groups in AI development and use?",True,True,relevant (variants),40,False
Are there any policies targeted to attracting and retaining AI talent in the United Kingdom?,True,True,relevant (original),41,True
Does the United Kingdom have any policies aimed at attracting and retaining AI talent?,True,True,relevant (variants),41,False
Are there any strategies in the UK for attracting and keeping AI professionals?,True,True,relevant (variants),41,False
UK got any rules for getting and keeping AI people?,True,True,relevant (variants),41,False
Any policies in UK for pull and keep AI talent?,True,True,relevant (variants),41,False
Are there any incentives to foster the creation of AI start-ups in Serbia? Are there any barriers?,True,True,relevant (original),42,True
Does Serbia offer any incentives to encourage the establishment of AI start-ups? Are there any obstacles?,True,True,relevant (variants),42,False
Are there any benefits provided by Serbia to promote AI start-ups? Any hindrances?,True,True,relevant (variants),42,False
Serbia got any incentives for making AI start-ups? Any barriers?,True,True,relevant (variants),42,False
Any incentives in Serbia for AI start-ups? Any barriers?,True,True,relevant (variants),42,False
"Are there AI policies in UAE helping to build human capacity (e.g. reskill, upskill, etc.)?",True,True,relevant (original),43,True
Does UAE have AI policies that aid in human capacity building such as reskilling and upskilling?,True,True,relevant (variants),43,False
Are there any AI strategies in UAE that contribute to human capacity development like reskilling or upskilling?,True,True,relevant (variants),43,False
"UAE got AI policies for building human capacity, like reskill, upskill?",True,True,relevant (variants),43,False
"AI policies in UAE for human capacity build, reskill, upskill, they exist?",True,True,relevant (variants),43,False
Are there AI policies in Serbia supporting research and development?,True,True,relevant (original),44,True
Does Serbia have policies supporting AI research and development?,True,True,relevant (variants),44,False
Are there any policies in Serbia that support AI research and development?,True,True,relevant (variants),44,False
Is there any support from Serbian policies for AI research and development?,True,True,relevant (variants),44,False
Serbia got policies for AI research and development support?,True,True,relevant (variants),44,False
Has Canada set up AI research centres as part of its national AI strategy?,True,True,relevant (original),45,True
Did Canada establish AI research centres under its national AI strategy?,True,True,relevant (variants),45,False
Is it true that Canada has AI research centres as part of its national AI strategy?,True,True,relevant (variants),45,False
"Canada set up AI research centres for national AI strategy, yes?",True,True,relevant (variants),45,False
"AI research centres, part of Canada's national AI strategy, they exist?",True,True,relevant (variants),45,False
Are there any policies in Canada related to large language models?,True,True,relevant (original),46,True
Does Canada have any policies regarding large language models?,True,True,relevant (variants),46,False
Are there policies about large language models in Canada?,True,True,relevant (variants),46,False
"In Canada, are there any rules or regulations concerning large language models?",True,True,relevant (variants),46,False
Canada got any rules for big language models?,True,True,relevant (variants),46,False
Are there any policies in the United States related to data centres and compute capacity?,True,True,relevant (original),47,True
Does the United States have any policies regarding data centres and compute capacity?,True,True,relevant (variants),47,False
Are there any US regulations concerning data centres and compute capacity?,True,True,relevant (variants),47,False
"In the United States, are there policies about data centres and compute capacity?",True,True,relevant (variants),47,False
US got any rules for data centres and compute capacity?,True,True,relevant (variants),47,False
What official bodies are responsible for AI strategy in the UK?,True,True,relevant (original),48,True
Which formal organizations in the UK are in charge of AI strategy?,True,True,relevant (variants),48,False
Can you tell me the official entities responsible for AI strategy in the UK?,True,True,relevant (variants),48,False
Who's handling the AI strategy in the UK officially?,True,True,relevant (variants),48,False
